### DISCUSSION TITLE
Official MQTT broker having connection issues

### DISCUSSION THREAD

**Discussion by brianshea2** [meshtastic/Discussions#301] [General]
The meshmap.net connection to the official MQTT broker has been disconnecting and reconnecting every couple minutes for days now, causing map updates to be delayed or missed entirely, with many nodes no longer showing. This is not the first occurrence of the public broker being unstable for an extended period of time. What can we do to fix this and prevent it from happening again?

**Comment by fsgh42** [comment]
* first and foremost: running public services like this one obviously requires some dedication. Servers must be paid and kept up to date, outages should be addressed and for this you need humans that have the time to do these things. Ensure enough people and monitoring are in place and have a overall strategy on how to run the system. If either one is a problem, ask the community for help.
* spread out the deployment across multiple data centers. might not only make the message broker resilient, helps improve client connectivity stability as well and avoids sending data around the globe. requires a distributed software setup, though. not easy.
* I doubt that the actual load on the server was too terribly high, but the system could of course go down due to resource exhaustion. Over time, the system might need more suitably sized machines, as meshtastic grows in device numbers using the message broker.
* redesign the system to be a true distributed network of MQTT brokers, mostly run by community members. Not easy, but not impossible either.

All of the above can be also be tackled by simply paying a company for handling all of these, by using a `SaaS` solution. This is usually of course significantly easier, but has a price tag, of course.

I can offer to talk to whoever is running the message broker and see if and how the community could help with the above.

**Reply by blue4world** [reply]
I’m also experiencing MQTT connection issues—both on the iOS app and when connecting from a desktop using the [acidvegas/meshtastic-mqtt-json](https://github.com/acidvegas/meshtastic-mqtt-json) client. The frequent disconnects are making the system difficult to use reliably.

I’m happy to help out. It would be great to get in touch with whoever is currently maintaining the MQTT server so we can coordinate efforts and determine what kind of support is needed—whether it’s infrastructure, monitoring, or other forms of community involvement.

**Reply by frantsch** [reply]
... for quite good money, of course!

**Comment by RCDudefpv** [comment]
My Two main nodes went of the maps few days ago, i seen most of the local nodes in Scotland all disappear from the maps a few days later, any help i can give , give me a shout

**Comment by spmedia** [comment]
If I can help in any way, like spinning up a server in a certain geo for it, let me know.

Lets get these maps 🗺️ fixed!

**Reply by fscheps** [reply]
Hi there, exactly we can buy a lifetime Zap Hosting Server and use that

**Comment by gkowalski** [comment]
Well switching to https://meshtastic.liamcottle.net/ as that system has no issues

**Reply by garthvh** [reply]
Messaging does not work and your data is stored there permanently, so there are some issues.

**Reply by RCGV1** [reply]
Data is deleted within 1 week on his server

**Comment by drveni** [comment]
mqtt server is down. just ping and no response

**Comment by evenstephen** [comment]
CloudFlare has their new Pub/Sub service currently in private beta and it is actually MQTT under the hood.  Global scaling is their bread and butter.  With the visibility of the Meshtastic project I wonder if they’d be willing to become a partner/sponsor?

**Reply by fsgh42** [reply]
good idea

**Reply by fifieldt** [reply]
@evenstephen , just to keep you updated - we did take this suggestion and have recently become connected with them. Not sure anything will come of it, but just wanted to let you know.

**Comment by Marusame00** [comment]
meshmap.net redirects to this very thread, thought I was going insane for a moment but it seems to be the case.

**Comment by brianshea2** [comment]
I have the website redirecting here while the MQTT downtime persists.
Otherwise you'd be looking at an empty map right now 😆

**Comment by brianshea2** [comment]
Can anyone from Meshtastic chime in here? It's been well over a week now since the MQTT service has gone down.

**Reply by RFJunkie** [reply]
I guess Meshtastic is dead, oh well. It was fun.

**Reply by thebentern** [reply]
> Can anyone from Meshtastic chime in here? It's been well over a week now since the MQTT service has gone down.

Hi Brian,

After migrating to a new Droplet in Digital Ocean, ironically with both more compute and memory resources we have seen a lot of network connectivity issues with the new host. Everything is configured identically, and the broker is running and pub/subbing hundreds of thousands of packets a day. As of this moment, we are puzzled why the connections have been more sluggish / unreliable on this new infra, because everything is configured identically. I will continue to investigate as I get time, but the default public broker has always been something we have hosted for free as a starting point for folks to test and experiment. I would not rely on it for anything mission critical. I may attempt to create a new droplot on another region to rule out any issues there.

**Reply by geeksville** [reply]
hi @thebentern (I know I'm not an active dev by any means but...)

I forget how the MQTT server was setup when I handed it off to MC.  And I'm not sure how ya'll have evolved it since.    Is the meshtastic MQTT server already 'dockerized' (i.e. an easy to configure deploy docker image)?  

If not, I've been doing a lot lately with docker and I'd probably be able to sign up for this.  I could make a nice clean image that is guaranteed deployable (with all dependencies and nice volume support for critical state) with a single command.  Then it would probably be easier for you (or anyone else who wants to host a meshtastic configed MQTT broker.

I have some time this week if it would help.  If not useful no pressure.

You rock btw!

**Reply by brianshea2** [reply]
Just to reiterate, since I was surprised to hear the broker is up and running in a new instance, I've been unable to connect at all for several days. Each attempt times out.

**Reply by andrewthetechie** [reply]
Hi @thebentern, I'd suggest reaching out to DigitalOcean support to have then check their networking or to check for noisy neighbors.

Feel free to reach out if you need some assistance, I've got some expertise in running MQTT and other message queues in the cloud.

**Reply by TheITJuggler** [reply]
Long time UNIX admin, Docker aficionado, and MQTT mid-level.. Happy to help out if needed.

**Comment by brianshea2** [comment]
MeshMap.net has always been a fun side project for me, originally started to fill my own want of having an online map when there was none (besides self-reported), and continuing to serve primarily, at least in my mind, as a way to promote adoption.

That being said, I have no strong opinions about how the map should be run. My goal was to create a simple, live, low-noise map of active nodes around the world. That last part, I think, is where my and Liam's goals differ the most, as nodes on MeshMap.net completely disappear after no location updates for 24 hours, and I've considered even lowering that. I think having two (or more) different maps to choose from is great, but I do wish there was a single source of truth for such a global node map. I'm not personally a fan of Liam's choice to stand up a separate MQTT broker for his map, as that has led to disjunct data sets. I don't blame him, our maps have different goals, and the recent privacy enhancements to the official MQTT service certainly did limit the usefulness of these maps. I decided to follow along with Meshtastic's and, hopefully, the wider community's wishes.

So now I wonder, what are Meshtastic's and the community's wants for an online map? Should a global map pulling from the project's "starting point for folks to test and experiment" MQTT broker even exist? Do people want a separate MQTT broker for the map, similar to Liam's? Should I refocus the MeshMap project to be more easily self-hosted for smaller community meshes? Heck, I'd even consider handing over the site to the Meshtastic project if wanted, though I fully believe they'd have no problem creating their own, and one would already exist, if that were the case. Or, should MeshMap continue as-is, assuming the official MQTT broker gets fixed?

**Reply by CamFlyerCH** [reply]
I would realy like to have the default MQTT broker back running again and the map was fine exactly as it was. What I think is a real good differnece of Liam's implementation of the MQTT broker, was that it was only there for the map and you can not subscribe and read all the messages. For the probably only few people that used the default MQTT broker to connect different networks, I think a self-hosted dedicated MQTT broker is the better solution. And you can still push your local MQTT data to the public one to find your nodes also on the map. Perhaps this would also reduce the load on the public broker a lot and make it more stable.

**Reply by cpatulea** [reply]
I believe also a significant difference between the two maps is the handling of `MAP_REPORT_APP` packets (*). I'm not confident of my reading of the code, so I don't want to say something possibly wrong, but there are differences.

(*) I believe this is the feature which allows sending map reports over MQTT (https://meshtastic.org/docs/configuration/module/mqtt/#map-reporting-enabled) without otherwise enabling general uplink of all packets. Personally I prefer a mode like this for my nodes.

**Reply by frantsch** [reply]
I am with @CamFlyerCH, @brianshea2! Get meshmap up and running again as it was as soon as possible, please! And subsequently you might lead a serious discussion on omitting the network messaging functionality as suggested, which I agree on.

**Reply by brianshea2** [reply]
To the Meshtastic folks, maybe it's possible to add a special map-only root topic that does not relay messages?

I still think there's general confusion around the Map Reporting toggle, as in it does not act as a gateway node for other nodes to be mapped.

**Comment by jp-bennett** [comment]
@brianshea2 Can you check if you're still having problems? I rolled some Linux tuning parameters out at about noon Central time today (an hour and a half ago) and the server seems to be *much* more responsive now. I think there is absolutely some thinking to be done about how the MQTT server needs to evolve in the future, but I want to get this current technical showstopper fixed first.

**Reply by cpatulea** [reply]
```
$ ping mqtt.meshtastic.org
PING mqtt.meshtastic.org (134.199.231.220) 56(84) bytes of data.
64 bytes from 134.199.231.220 (134.199.231.220): icmp_seq=1 ttl=47 time=88.6 ms
64 bytes from 134.199.231.220 (134.199.231.220): icmp_seq=2 ttl=47 time=86.4 ms
64 bytes from 134.199.231.220 (134.199.231.220): icmp_seq=3 ttl=47 time=86.1 ms
64 bytes from 134.199.231.220 (134.199.231.220): icmp_seq=4 ttl=47 time=85.5 ms
64 bytes from 134.199.231.220 (134.199.231.220): icmp_seq=5 ttl=47 time=85.7 ms
64 bytes from 134.199.231.220 (134.199.231.220): icmp_seq=6 ttl=47 time=84.1 ms
^C
--- mqtt.meshtastic.org ping statistics ---
6 packets transmitted, 6 received, 0% packet loss, time 5008ms
rtt min/avg/max/mdev = 84.065/86.068/88.637/1.360 ms

$ mosquitto_sub -h mqtt.meshtastic.org -u meshdev -P large4cats -i "aabbccdd" -t 'msh/US/#' -v | pv >/dev/null
^C06KiB 0:00:44 [27.9KiB/s] [                                   <=>                                                                     ]
```

**Reply by brianshea2** [reply]
It connected! It took a few seconds for some reason, but is receiving messages. Seems to be a flood of a few nodes sending Map Report messages multiple times per second.

**Reply by brianshea2** [reply]
It's disconnected, timed out, and reconnected a couple times already. Still a bit unstable.

**Reply by brianshea2** [reply]
I'm racking up my blocked node list. Is there anything that can be done on your side to kick off these nodes sending multiples per second?

**Reply by CamFlyerCH** [reply]
ICMP Echo (Ping) seams very stable, but performing a TCP ping shows the issue :

![image](https://github.com/user-attachments/assets/ea150a0a-1a70-4480-86e3-a96163a6c10b)

Very likely a network issue.

**Reply by jp-bennett** [reply]
> I'm racking up my blocked node list. Is there anything that can be done on your side to kick off these nodes sending multiples per second?

Some sort of fail2ban style plugin seems appropriate here. I'll see if we can do anything about it.

**Reply by brianshea2** [reply]
Quick update, still getting disconnected and timing out frequently. When it connects, a flood of Map Reports come in (only from a handful of nodes), then generally loses connection a few minutes later.

**Reply by tsalisbury0** [reply]
I deployed the MeshSTL MQTT server to help offload from the public one. Still working on getting the map working (currently looking for a cheap Docker host to run the scripts needed to run the push to the map). If you need connection details I can get them to you.

**Reply by garthvh** [reply]
> I deployed the MeshSTL MQTT server to help offload from the public one. Still working on getting the map working (currently looking for a cheap Docker host to run the scripts needed to run the push to the map). If you need connection details I can get them to you.

The official server is running, if you are not zero hopping packets the Lora mesh will quickly be flooded.

**Reply by tsalisbury0** [reply]
> > I deployed the MeshSTL MQTT server to help offload from the public one. Still working on getting the map working (currently looking for a cheap Docker host to run the scripts needed to run the push to the map). If you need connection details I can get them to you.
> 
> The official server is running, if you are not zero hopping packets the Lora mesh will quickly be flooded.

I'm getting errors connecting to the main on via MQTT explorer.

**Comment by brianshea2** [comment]
Website is temporarily redirecting here again. I've been unable to connect to the MQTT service at all for a couple days.

**Reply by fifieldt** [reply]
@brianshea2 , how can we find you on discord? The service had looked more stable in the past two days, so we want to investigate if the map feed was triggering a bug in the server code :)

**Reply by brianshea2** [reply]
I'm not on discord. Are you saying you want to investigate if mqtt traffic is crashing the meshmap backend? What I'm seeing is each tcp connection attempt to 134.199.231.220:1883 timing out.

**Reply by fifieldt** [reply]
Ah, unfortunate - was hoping for some real-time debugging. Actually, the opposite - hoping to see if the more robust connection from meshmap is tripping up the MQTT server code in some way.

**Reply by brianshea2** [reply]
Is it possible meshmap's ip made it to some block list on the mqtt server, maybe for the repetitive failed connection attempts (every couple minutes)?

**Reply by trickv** [reply]
I've seen similar behavior the last few weeks; I've been developing an app that talks to MQTT. I set up a little */5 TCP connect probe on uptimerobot.com to try and show the ups and downs.  This isn't even getting to the point of subscribing to anything, it's literally just not being able to open a TCP socket: https://stats.uptimerobot.com/KB1QJHDnJx/800415559

I am on Discord if I can be of service...I know a thing or two about Linux servers...my handle is @trickv

**Reply by fifieldt** [reply]
Thanks team. Have some IPs we can trawl the logs for?

**Reply by jpryor223** [reply]
I have two nodes that have MQTT enabled in the past, have not been able to connect recently.

Check for traffic from my external public IP 134.215.29.240

Debug logs from the MQTT node I have set for client hidden and zero hop with uplink/download MQTT enabled.  It does five attempts and then resets the Wifi, continuously unable to connect, let it run for a bit in the past 30 minutes...

INFO | 21:49:04 2302 [mqtt] Use non-TLS-encrypted session

INFO | 21:49:04 2302 [mqtt] Connecting directly to MQTT server mqtt.meshtastic.org, port: 1883, username: meshdev, password: [redacted]

[2305726][I][WiFiClient.cpp:260] connect(): select returned due to timeout 3000 ms for fd 53

WARN | 21:49:07 2305 [mqtt] Failed to connect to MQTT server

ERROR | 21:49:07 2305 [mqtt] Failed to contact MQTT server directly (5/5)

**Reply by trickv** [reply]
My little python app which is read-only on MQTT using paho-mqtt had managed to acquire a connection, but I restarted it 30 mins ago and it's currently in a connect-retry loop, waiting 60 seconds between tries, never getting a TCP socket:
```
Traceback (most recent call last):
  File "/home/trick/src/github.com/trickv/sondehub-meshtastic-mqtt-gateway/./main.py", line 187, in <module>
    client.connect(MQTT_BROKER, 1883, 60)
  File "/home/trick/mt-venv/lib/python3.10/site-packages/paho/mqtt/client.py", line 914, in connect
    return self.reconnect()
  File "/home/trick/mt-venv/lib/python3.10/site-packages/paho/mqtt/client.py", line 1044, in reconnect
    sock = self._create_socket_connection()
  File "/home/trick/mt-venv/lib/python3.10/site-packages/paho/mqtt/client.py", line 3685, in _create_socket_connection
    return socket.create_connection(addr, timeout=self._connect_timeout, source_address=source)
  File "/usr/lib/python3.10/socket.py", line 845, in create_connection
    raise err
  File "/usr/lib/python3.10/socket.py", line 833, in create_connection
    sock.connect(sa)
TimeoutError: timed out
```

At a tcpdump level I'm sending SYN and getting no ACK:
```
root@frylock:~# tcpdump -n -i eth1 host mqtt.meshtastic.org
tcpdump: verbose output suppressed, use -v[v]... for full protocol decode
listening on eth1, link-type EN10MB (Ethernet), snapshot length 262144 bytes
03:42:19.579649 IP 208.59.96.66.36357 > 134.199.231.220.1883: Flags [S], seq 2991260633, win 64240, options [mss 1460,sackOK,TS val 2792700916 ecr 0,nop,wscale 7], length 0
03:42:20.591281 IP 208.59.96.66.36357 > 134.199.231.220.1883: Flags [S], seq 2991260633, win 64240, options [mss 1460,sackOK,TS val 2792701928 ecr 0,nop,wscale 7], length 0
03:42:22.607440 IP 208.59.96.66.36357 > 134.199.231.220.1883: Flags [S], seq 2991260633, win 64240, options [mss 1460,sackOK,TS val 2792703944 ecr 0,nop,wscale 7], length 0
03:43:26.171564 IP 208.59.96.66.50201 > 134.199.231.220.1883: Flags [S], seq 3392176678, win 64240, options [mss 1460,sackOK,TS val 2792767508 ecr 0,nop,wscale 7], length 0
03:43:27.187421 IP 208.59.96.66.50201 > 134.199.231.220.1883: Flags [S], seq 3392176678, win 64240, options [mss 1460,sackOK,TS val 2792768524 ecr 0,nop,wscale 7], length 0
03:43:29.204939 IP 208.59.96.66.50201 > 134.199.231.220.1883: Flags [S], seq 3392176678, win 64240, options [mss 1460,sackOK,TS val 2792770536 ecr 0,nop,wscale 7], length 0
```

My IP: 208.59.96.66

As for UptimeRobot, which has been probing for weeks, they use a fleet of v4 addresses if you _really_ want to go looking for those: 
https://uptimerobot.com/inc/files/ips/IPv4.txt

Happy to schedule a screen share / video chat - I imagine the scaling issues of running this server with tens of thousands of clients around the world constantly opening/closing connections is not simple and while I can't promise I can find an answer I'd enjoy to understand the problem :)

**Reply by trickv** [reply]
Still in a connect-retry loop now an hour later. Not been able to establish a single connection.

LMK if I can help more!

**Reply by jp-bennett** [reply]
We just swung the DNS entry to a new droplet that's running the daemon outside of Docker. So far it appears to be performing much better. Very interested to hear if it's actually working as expected now.

**Reply by brianshea2** [reply]
Looking promising so far. I'll monitor for a bit and switch the map back on if it holds steady.

**Reply by trickv** [reply]
Anecdotally seems OK too. My little subscriber app has registered 833k messages in ten hours which is a lot more than I was getting, which would indicate lots of nodes in the world have connected. But that’s anecdotal.

here’s something encouraging: uptimerobot says it’s been available for a solid ten hours straight: https://stats.uptimerobot.com/KB1QJHDnJx/800415559

this doesn’t perform a full MQTT subscribe and read any data, but this means that at least the base TCP layer of the app is reasonably healthy. 

Looks like good progress @jp-bennett !

(still happy to lend a hand if you want - getting it running inside Docker shouldn’t be a constraint…)

**Reply by brianshea2** [reply]
Looking stable over the last day from MeshMap's side. Thank you, Meshtastic folks :)

Circling back to a previous thought, any comments around having a special root topic that does not relay text messages? Or maybe a new firmware option? Would people find this useful? I personally set up a gateway node with channel uplink only to populate the map. As it is now, all messages get uplinked with no chance of seeing any response.

**Comment by Marusame00** [comment]
MQTT is seemingly up right now, longer than it has been in two weeks so maybe the issue is finally fixed fingers crossed?

**Comment by moored57** [comment]
Question: will the meshtastic.org mqtt server only work with the longfast lora modem preset settings? If I were to set up a group of friends on the lora LongMod modem presets, would it still provide mqtt service?

**Reply by garthvh** [reply]
Yep

**Reply by moored57** [reply]
thanks!!!

**Comment by brianshea2** [comment]
This is occurring again, unstable connections over the last week or so.

**Reply by trickv** [reply]
I can confirm, my UptimeRobot poller shows some timeouts over the past week.  Prior to that no notable issues since September.

**Reply by trickv** [reply]
https://stats.uptimerobot.com/KB1QJHDnJx/800415559

**Reply by fifieldt** [reply]
Apologies for the poor service @brianshea2 . We rolled out some new code this morning that should help. Monitoring closely, reports appreciated in #mqtt on discord.

**Reply by fifieldt** [reply]
@brianshea2 Public server update: about 12 hours ago we updated a bunch of major dependencies, after discovering one claimed some core performance improvements. It's looking good so far...

**Reply by brianshea2** [reply]
meshmap.net hasn't seen a disconnect in ~16 hours, looking good!

**Reply by brianshea2** [reply]
unstable again the last couple days

**Reply by fifieldt** [reply]
@brianshea2 , thanks for the report - I've restarted the broker for you.

We think we've identified the source of something akin to a memory leak and have coded a workaround. Going to try applying that shortly.

**Reply by fifieldt** [reply]
FYI https://github.com/meshtastic/dotnet-MQTTnet/pull/1
